id	title	repro	review 1	review 3	review 2
310-Paper0217	MAL: Multi-modal attention learning for tumor diagnosis based on bipartite graph and multiple branches				
311-Paper2233	MaNi: Maximizing Mutual Information for Nuclei Cross-Domain Unsupervised Segmentation				
312-Paper2849	Mapping in Cycles: Dual-Domain PET-CT Synthesis Framework with Cycle-Consistent Constraints	The description of the training details in this paper is insufficient. Moreover, the authors did not give any positive response regarding the code release in the reproducibility checklist. So I think this paper does not have good reproducibility.	The description of the training details in this paper is insufficient. Moreover, the authors did not give any positive response regarding the code release in the reproducibility checklist. So I think this paper does not have good reproducibility.		
313-Paper0549	Mask Rearranging Data Augmentation for 3D Mitochondria Segmentation				
314-Paper0438	MaxStyle: Adversarial Style Composition for Robust Medical Image Segmentation				
315-Paper0755	MCP-Net: Inter-frame Motion Correction with Patlak Regularization for Whole-body Dynamic PET				
316-Paper1909	Measurement-conditioned Denoising Diffusion Probabilistic Model for Under-sampled Medical Image Reconstruction				
317-Paper1138	Mesh-based 3D Motion Tracking in Cardiac MRI using Deep Learning				
318-Paper0422	Meta-hallucinator: Towards few-shot cross-modality cardiac image segmentation				
319-Paper2696	MIRST-DM: Multi-Instance RST with Drop-Max Layer for Robust Classification of Breast Cancer				
320-Paper1972	Mixed Reality and Deep Learning for External Ventricular Drainage Placement: a Fast and Automatic Workflow for Emergency Treatments				
321-Paper0363	mmFormer: Multimodal Medical Transformer for Incomplete Multimodal Learning of Brain Tumor Segmentation				
322-Paper0649	Modality-adaptive Feature Interaction for Brain Tumor Segmentation with Missing Modalities				
323-Paper1690	ModDrop++: A Dynamic Filter Network with Intra-subject Co-training for Multiple Sclerosis Lesion Segmentation with Missing Modalities				
324-Paper1665	Modelling Cycles in Brain Networks with the Hodge Laplacian				
325-Paper0964	Momentum Contrastive Voxel-wise Representation Learning for Semi-supervised Volumetric Medical Image Segmentation				
326-Paper2100	Morphology-Aware Interactive Keypoint Estimation				
327-Paper2818	Moving from 2D to 3D: volumetric medical image classification for rectal cancer staging				
328-Paper2326	MRI Reconstruction by Completing Under-sampled K-space Data with Learnable Fourier Interpolation				
329-Paper1984	mulEEG: A Multi-View Representation Learning on EEG Signals				
330-Paper0876	Multidimensional Hypergraph on Delineated Retinal Features for Pathological Myopia Task.	The reproducibility checklist was accurately filled out.  One thing that could improve reproducibility of the paper is to make the full code available after publication.		The reproducibility checklist was accurately filled out.  One thing that could improve reproducibility of the paper is to make the full code available after publication.	The checked points in the reproducibilty checklist match perfectly the information provided in the paper.
331-Paper1289	Multi-head Attention-based Masked Sequence Model for Mapping Functional Brain Networks				
332-Paper2758	Multi-institutional Investigation of Model Generalizability for Virtual Contrast-enhanced MRI Synthesis				
333-Paper0373	Multimodal Brain Tumor Segmentation Using Contrastive Learning based Feature Comparison with Monomodal Normal Brain Images	All the necessary checklist for the resproducibilty are provided.		All the necessary checklist for the resproducibilty are provided.	
334-Paper1961	Multimodal Contrastive Learning for Prospective Personalized Estimation of CT Organ Dose				
335-Paper2386	Multi-Modal Hypergraph Diffusion Network with Dual Prior for Alzheimer Classification				
336-Paper1841	Multi-Modal Masked Autoencoders for Medical Vision-and-Language Pre-Training				
337-Paper1488	Multi-modal Retinal Image Registration Using a Keypoint-Based Vessel Structure Aligning Network				
338-Paper1274	Multi-Modal Unsupervised Pre-Training for Surgical Operating Room Workflow Analysis	The authors present the method in such a manner that it should be reproducible. All the details provided on the checklist were truthful.	The authors present the method in such a manner that it should be reproducible. All the details provided on the checklist were truthful.		
339-Paper1682	Multimodal-GuideNet: Gaze-Probe Bidirectional Guidance in Obstetric Ultrasound Scanning	The experiments design and data generation are clearly described in the paper, which matches what the authors claimed in the reproducibility checklist.		The experiments design and data generation are clearly described in the paper, which matches what the authors claimed in the reproducibility checklist.	
340-Paper0966	Multiple Instance Learning with Mixed Supervision in Gleason Grading				
341-Paper0404	Multi-scale Super-resolution Magnetic Resonance Spectroscopic Imaging with Adjustable Sharpness				
342-Paper1789	Multiscale Unsupervised Retinal Edema Area Segmentation in OCT Images				
343-Paper2517	Multi-site Normative Modeling of Diffusion Tensor Imaging Metrics Using Hierarchical Bayesian Regression				
344-Paper0613	Multi-Task Lung Nodule Detection in Chest Radiographs with a Dual Head Network				
345-Paper2559	Multi-task video enhancement for dental interventions				
346-Paper1336	Multi-TransSP: Multimodal Transformer for Survival Prediction of Nasopharyngeal Carcinoma Patients				
347-Paper0568	Multi-view Local Co-occurrence and Global Consistency Learning Improve Mammogram Classification Generalisation				
348-Paper0534	MUSCLE: Multi-task Self-supervised Continual Learning to Pre-train Deep Models for X-ray Images of Multiple Body Parts				
349-Paper0974	NAF: Neural Attenuation Fields for Sparse-View CBCT Reconstruction				
350-Paper0929	NerveFormer: A Cross-Sample Aggregation Network for Corneal Nerve Segmentation	The detailed network architecture is not included in the paper. But the authors commit to releasing the code in the reproducibility checklist.		The detailed network architecture is not included in the paper. But the authors commit to releasing the code in the reproducibility checklist.	
351-Paper0436	NestedFormer: Nested Modality-Aware Transformer for Brain Tumor Segmentation				
352-Paper0117	Neural Annotation Refinement: Development of a New 3D Dataset for Adrenal Gland Analysis				
353-Paper1091	Neural Rendering for Stereo 3D Reconstruction of Deformable Tissues in Robotic Surgery				
354-Paper0240	Neuro-RDM: An Explainable Neural Network Landscape of Reaction-Diffusion Model for Cognitive Task Recognition	Upon reading the paper and the checklist, I found several inconsistencies. For example, I found no description of the parameter settings, architecture, range of parameter values, sensitivity to parameters, memory footprint or compute software in the paper.		Upon reading the paper and the checklist, I found several inconsistencies. For example, I found no description of the parameter settings, architecture, range of parameter values, sensitivity to parameters, memory footprint or compute software in the paper.	
355-Paper2027	Noise transfer for unsupervised domain adaptation of retinal OCT images				
356-Paper0041	Noise2SR: Learning to Denoise from Super-Resolved Single Noisy Fluorescence Image				
357-Paper1103	Non-iterative Coarse-to-fine Registration based on Single-pass Deep Cumulative Learning				
358-Paper0915	Nonlinear Conditional Time-varying Granger Causality of Task fMRI via Deep Stacking Networks and Adaptive Convolutional Kernels				
359-Paper0984	Nonlinear Regression of Remaining Surgical Duration via Bayesian LSTM-based Deep Negative Correlation Learning				
360-Paper0560	NVUM: Non-Volatile Unbiased Memory for Robust Medical Image Classification				
361-Paper2729	On Surgical Planning of Percutaneous Nephrolithotomy with Patient-Specific CTRs	The paper describes the generation of point clouds using Slicer3D. More detail would help with respect to filters and marching operations used to segment the CT data. Answers to reproducibility checklist make sense and the authors do a good job explaining the algorithm and tools they used.	The paper describes the generation of point clouds using Slicer3D. More detail would help with respect to filters and marching operations used to segment the CT data. Answers to reproducibility checklist make sense and the authors do a good job explaining the algorithm and tools they used.		
362-Paper0175	On the Dataset Quality Control for Image Registration Evaluation				
363-Paper1718	On the Uncertain Single-View Depths in Colonoscopies				
364-Paper0816	One-Shot Segmentation of Novel White Matter Tracts via Extensive Data Augmentation	The authors use open available data of the HPC. The authors use TractSeg as backbone, for which code is available. No code is provided in for the framework their paper is based on, nor in their paper. However, mathematical definitions are provided and based on the checklist the reproducibility seems to be given.			The authors use open available data of the HPC. The authors use TractSeg as backbone, for which code is available. No code is provided in for the framework their paper is based on, nor in their paper. However, mathematical definitions are provided and based on the checklist the reproducibility seems to be given.
365-Paper0658	Online Easy Example Mining for Weakly-supervised Gland Segmentation from Histology Images				
366-Paper1267	Online Reflective Learning for Robust Medical Image Segmentation				
367-Paper1419	OnlyCaps-Net, a capsule only based neural network for 2D and 3D semantic segmentation				
368-Paper0347	Only-Train-Once MR Fingerprinting for Magnetization Transfer Contrast Quantification				
369-Paper1164	Opinions Vary? Diagnosis First!				
370-Paper2723	Opportunistic Incidence Prediction of Multiple Chronic Diseases from Abdominal CT Imaging Using Multi-Task Learning				
371-Paper0303	Optimal MRI Undersampling Patterns for Pathology Localization				
372-Paper0371	Optimal Transport based Ordinal Pattern Tree Kernel for Brain Disease Diagnosis				
373-Paper0654	ORF-Net: Deep Omni-supervised Rib Fracture Detection from Chest CT Scans				
374-Paper1581	Orientation-guided Graph Convolutional Network for Bone Surface Segmentation	The paper has a reasonable level of repeatability, providing details about the hyperparameters and systems used. The authors also indicate that code will be made available. The dataset appears to be acquired internally but the authors indicate in the reproducibility checklist that the dataset could be accessed by others.		The paper has a reasonable level of repeatability, providing details about the hyperparameters and systems used. The authors also indicate that code will be made available. The dataset appears to be acquired internally but the authors indicate in the reproducibility checklist that the dataset could be accessed by others.	
375-Paper2185	Orientation-Shared Convolution Representation for CT Metal Artifact Learning				
376-Paper1923	Out-of-Distribution Detection for Long-tailed and Fine-grained Skin Lesion Images				
377-Paper0142	Overlooked Trustworthiness of Saliency Maps				
378-Paper0938	Parameter-free latent space transformer for zero-shot bidirectional cross-modality liver segmentation				
379-Paper1793	Patcher: Patch Transformers with Mixture of Experts for Precise Medical Image Segmentation				
380-Paper1843	Patch-wise Deep Metric Learning for Unsupervised Low-Dose CT Denoising				
381-Paper1020	PD-DWI: Predicting response to neoadjuvant chemotherapy in invasive breast cancer with Physiologically-Decomposed Diffusion-Weighted MRI machine-learning model				
382-Paper1435	Personalized Diagnostic Tool for Thyroid Cancer Classification using Multi-view Ultrasound				
383-Paper2497	Personalized dMRI Harmonization on Cortical Surface				
384-Paper0842	PET denoising and uncertainty estimation based on NVAE model using quantile regression loss	"The authors ticked ""Yes"" for most items of the reproductibility checklist, which is sometimes in contradiction with what is provided in the paper (e.g. range of hyper-parameters considered). It seems that the code will be made available."	"The authors ticked ""Yes"" for most items of the reproductibility checklist, which is sometimes in contradiction with what is provided in the paper (e.g. range of hyper-parameters considered). It seems that the code will be made available."		
385-Paper0844	PHTrans: Parallelly Aggregating Global and Local Representations for Medical Image Segmentation				
386-Paper0288	Physically Inspired Constraint for Unsupervised Regularized Ultrasound Elastography				
387-Paper0495	Physiological Model based Deep Learning Framework for Cardiac TMP Recovery				
388-Paper2184	Physiology-based simulation of the retinal vasculature enables annotation-free segmentation of OCT angiographs				
389-Paper0677	Point Beyond Class: A Benchmark for Weakly Semi-Supervised Abnormality Localization in Chest X-Rays	The author did not mention the code in the paper, but according to the checklist, it seems they will release the code after acceptation. Please make clear. I suggest that at least release the splitting of the training set and the test set, which may help in pursuing the goal of setting a benchmark for the field.	The author did not mention the code in the paper, but according to the checklist, it seems they will release the code after acceptation. Please make clear. I suggest that at least release the splitting of the training set and the test set, which may help in pursuing the goal of setting a benchmark for the field.		
390-Paper0008	Poisson2Sparse: Self-Supervised Poisson Denoising From a Single Image				
391-Paper2552	Pose-based Tremor Classification for Parkinson's Disease Diagnosis from Video				
392-Paper0672	Position-prior Clustering-based Self-attention Module for Knee Cartilage Segmentation				
393-Paper0764	Predicting molecular traits from tissue morphology through self-interactive multi-instance learning				
394-Paper1668	Predicting Spatio-Temporal Human Brain Response Using fMRI				
395-Paper1700	Privacy Preserving Image Registration				
396-Paper0683	ProCo: Prototype-aware Contrastive Learning for Long-tailed Medical Image Classification				
397-Paper1110	Prognostic Imaging Biomarker Discovery in Survival Analysis for Idiopathic Pulmonary Fibrosis				
398-Paper0362	Progression models for imaging data with Longitudinal Variational Auto Encoders				
399-Paper1523	Progressive Deep Segmentation of Coronary Artery via Hierarchical Topology Learning				
400-Paper0603	Progressive Subsampling for Oversampled Data - Application to Quantitative MRI				
401-Paper2710	Prostate Cancer Histology Synthesis using StyleGAN Latent Space Annotation				
402-Paper1589	PRO-TIP: Phantom for RObust automatic ultrasound calibration by TIP detection				
403-Paper1074	Prototype Learning of Inter-network Connectivity for ASD Diagnosis and Personalized Analysis	Reproducibility is fairly good - based on the checklist/submission it appears code will be shared with acceptance. However, there is some missing experimental analysis (e.g. parameter sensitivity, statistical significance, when does method fail) that could be added to improve the paper.		Reproducibility is fairly good - based on the checklist/submission it appears code will be shared with acceptance. However, there is some missing experimental analysis (e.g. parameter sensitivity, statistical significance, when does method fail) that could be added to improve the paper.	
404-Paper0648	Pseudo Bias-Balanced Learning for Debiased Chest X-ray Classification	The authors provide all the source code in the checklist and supplemental materials. And they use public dataset which is beneficial for reproducing the work.		The authors provide all the source code in the checklist and supplemental materials. And they use public dataset which is beneficial for reproducing the work.	
405-Paper1613	Radiological Reports Improve Pre-Training for Localized Imaging Tasks on Chest X-Rays				
406-Paper1231	RandStainNA: Learning Stain-Agnostic Features from Histology Slides by Bridging Stain Augmentation and Normalization				
407-Paper0281	Real-Time 3D Reconstruction of Human Vocal Folds via High-Speed Laser-Endoscopy				
408-Paper2438	Recurrent Implicit Neural Graph for Deformable Tracking in Endoscopic Videos				
409-Paper0524	Reducing Positional Variance in Cross-sectional Abdominal CT Slices with Deep Conditional Generative Models				
410-Paper1513	RefineNet: An Automated Framework to Generate Task and Subject-Specific Brain Parcellations for Resting-State fMRI Analysis				
411-Paper2050	Region Proposal Rectification Towards Robust Instance Segmentation of Biological Images				
412-Paper2308	Region-guided CycleGANs for Stain Transfer in Whole Slide Images				
413-Paper1821	Regression Metric Loss: Learning a Semantic Representation Space for Medical Images				
414-Paper1003	Reinforcement Learning Driven Intra-modal and Inter-modal Representation Learning for 3D Medical Image Classification				
415-Paper1608	Reinforcement learning for active modality selection during diagnosis				
416-Paper2249	Reliability of quantification estimates in MR Spectroscopy: CNNs vs. traditional model fitting				
417-Paper0724	Reliability-aware Contrastive Self-ensembling for Semi-supervised Medical Image Classification				
418-Paper0235	ReMix: A General and Efficient Framework for Multiple Instance Learning based Whole Slide Image Classification				
419-Paper1023	RemixFormer: A Transformer Model for Precision Skin Tumor Differential Diagnosis via Multi-modal Imaging and Non-imaging Data				
420-Paper0090	Removal of Confounders via Invariant Risk Minimization for Medical Diagnosis				
421-Paper2844	RepsNet: Combining Vision with Language for Automated Medical Reports				
422-Paper1632	Residual Wavelon Convolutional Networks for Characterization of Disease Response on MRI				
423-Paper2639	Rethinking Breast Lesion Segmentation in Ultrasound: A New Video Dataset and A Baseline Network				
424-Paper0739	Rethinking Surgical Captioning: End-to-End Window-Based MLP Transformer Using Patches				
425-Paper0641	Rethinking Surgical Instrument Segmentation: A Background Image Can Be All You Need				
426-Paper2077	Retrieval of surgical phase transitions using reinforcement learning				
427-Paper1808	Revealing Continuous Brain Dynamical Organization with Multimodal Graph Transformer				
428-Paper0359	Rib Suppression in Digital Chest Tomosynthesis				
429-Paper2294	Robust Segmentation of Brain MRI in the Wild with Hierarchical CNNs and no Retraining				
430-Paper0042	RPLHR-CT Dataset and Transformer Baseline for Volumetric Super-Resolution from CT Scans				
431-Paper2738	RT-DNAS: Real-time Constrained Differentiable Neural Architecture Search for 3D Cardiac Cine MRI Segmentation	Ok. Authors mention in the reproducibility checklist that the code will be available.		Ok. Authors mention in the reproducibility checklist that the code will be available.	
432-Paper2234	RTN: Reinforced Transformer Network for Coronary CT Angiography Vessel-level Image Quality Assessment				
433-Paper0279	S3R: Self-supervised Spectral Regression for Hyperspectral Histopathology Image Classification				
434-Paper0610	S5CL: Unifying Fully-Supervised, Self-Supervised, and Semi-Supervised Learning Through Hierarchical Contrastive Learning				
435-Paper0710	Sample hardness based gradient loss for long-tailed cervical cell detection				
436-Paper0559	SAPJNet: Sequence-Adaptive Prototype-Joint Network for Small Sample Multi-Sequence MRI Diagnosis				
437-Paper0153	SATr: Slice Attention with Transformer for Universal Lesion Detection				
438-Paper2686	Scale-Equivariant Unrolled Neural Networks for Data-Efficient Accelerated MRI Reconstruction				
439-Paper1966	Screening of Dementia on OCTA Images via Multi-projection Consistency and Complementarity				
440-Paper1416	Scribble2D5: Weakly-Supervised Volumetric Image Segmentation via Scribble Annotations				
441-Paper0453	Scribble-Supervised Medical Image Segmentation via Dual-Branch Network and Dynamically Mixed Pseudo Labels Supervision				
442-Paper1998	SD-LayerNet: Semi-supervised retinal layer segmentation in OCT using disentangled representation with anatomical priors				
443-Paper1826	SeATrans: Learning Segmentation-Assisted diagnosis model via Transformer	The authors have used public data and they will make their code public, according to their answers in the checklist. So I believe their work is reproducible.		The authors have used public data and they will make their code public, according to their answers in the checklist. So I believe their work is reproducible.	
444-Paper2257	Segmentation of Whole-brain Tractography: A Deep Learning Algorithm Based on 3D Raw Curve Points				
445-Paper1676	Self-Ensembling Vision Transformer (SEViT) for Robust Medical Image Classification	As listed reproducibility checklist, the work should be in good reproducibility.		As listed reproducibility checklist, the work should be in good reproducibility.	
446-Paper1504	Self-learning and One-shot Learning based Single-slice Annotation for 3D Medical Image Segmentation				
447-Paper1341	SelfMix: A Self-adaptive Data Augmentation Method for Lesion Segmentation				
448-Paper2822	Self-Rating Curriculum Learning for Localization and Segmentation of Tuberculosis on Chest Radiograph				
449-Paper0442	Self-supervised 3D anatomy segmentation using self-distilled masked image transformer (SMIT)				
450-Paper1766	Self-supervised 3D Patient Modeling with Multi-modal Attentive Fusion				
451-Paper0450	Self-Supervised Depth Estimation in Laparoscopic Image using 3D Geometric Consistency				
452-Paper2634	Self-Supervised Learning of Morphological Representation for 3D EM Segments with Cluster-Instance Correlations				
453-Paper2043	Self-Supervised Pre-Training for Nuclei Segmentation				
454-Paper0106	Semi-supervised histological image segmentation via hierarchical consistency enforcement				
455-Paper0597	Semi-supervised Learning for Nerve Segmentation in Corneal Confocal Microscope Photography				
456-Paper1900	Semi-supervised learning with data harmonisation for biomarker discovery from resting state fMRI	The authors have checked off all relevant items on the reproducibility checklist, including sharing of code, and the reporting in the paper matches the checklist, so should be highly reproducible.		The authors have checked off all relevant items on the reproducibility checklist, including sharing of code, and the reporting in the paper matches the checklist, so should be highly reproducible.	
457-Paper0358	Semi-Supervised Medical Image Classification with Temporal Knowledge-Aware Regularization				
458-Paper0427	Semi-Supervised Medical Image Segmentation Using Cross-Model Pseudo-Supervision with Shape Awareness and Local Context Constraints				
459-Paper1441	Semi-Supervised PR Virtual Staining for Breast Histopathological Images				
460-Paper0482	Semi-Supervised Spatial Temporal Attention Network for Video Polyp Segmentation				
461-Paper0543	Sensor Geometry Generalization to Untrained Conditions in Quantitative Ultrasound Imaging	"In the reproducibility checklist, authors claim that they share a sample test dataset and their code. The current version of the manuscript has no links to open source repositories, but I expect authors would make data and code available upon acceptance. I see it very difficult to replicate the method and reproduce the results by only following the description provided in the paper, due to the complexity of the proposed architecture. Moreover, authors declare that ethical approval is ""not applicable"" to their work. Actually, since their evaluation include real patient data, ethical approval should be present."	"In the reproducibility checklist, authors claim that they share a sample test dataset and their code. The current version of the manuscript has no links to open source repositories, but I expect authors would make data and code available upon acceptance. I see it very difficult to replicate the method and reproduce the results by only following the description provided in the paper, due to the complexity of the proposed architecture. Moreover, authors declare that ethical approval is ""not applicable"" to their work. Actually, since their evaluation include real patient data, ethical approval should be present."		
462-Paper0415	SETMIL: Spatial Encoding Transformer-based Multiple Instance Learning for Pathological Image Analysis				
463-Paper2204	SGT: Scene Graph-Guided Transformer for Surgical Report Generation	According to the reproducibility checklist, the source code and pretrained models will be made publicly available, which is essential to guarantee the reproducibility of the results. Additionally, the method was developed using a public benchmark dataset for surgical report generation, which promotes research in the area.			According to the reproducibility checklist, the source code and pretrained models will be made publicly available, which is essential to guarantee the reproducibility of the results. Additionally, the method was developed using a public benchmark dataset for surgical report generation, which promotes research in the area.
464-Paper0193	Shape-Aware Weakly/Semi-Supervised Optic Disc and Cup Segmentation with Regional/Marginal Consistency				
465-Paper1627	Shape-based features of white matter fiber-tracts associated with outcome in Major Depression Disorder				
