id	title	repro	review 1	review 3	review 2
001-Paper1347	3D CVT-GAN: A 3D Convolutional Vision Transformer-GAN for PET Reconstruction				
002-Paper1233	3D Global Fourier Network for Alzheimer's Disease Diagnosis using Structural MRI				
003-Paper1512	4D-OR: Semantic Scene Graphs for OR Domain Modeling				
004-Paper2655	A Comprehensive Study of Modern Architectures and Regularization Approaches on CheXpert5000				
005-Paper1525	A Deep-Discrete Learning Framework for Spherical Surface Registration				
006-Paper1155	A Geometry-Constrainted Deformable Attention Network for Aortic Segmentation				
007-Paper1247	A Hybrid Propagation Network for Interactive Volumetric Image Segmentation				
008-Paper0063	A Learnable Variational Model for Joint Multimodal MRI Reconstruction and Synthesis				
009-Paper1374	A Medical Semantic-Assisted Transformer for Radiographic Report Generation				
010-Paper1785	A Multi-task Network with Weight Decay Skip Connection Training for Anomaly Detection in Retinal Fundus Images				
011-Paper1016	A New Dataset and A Baseline Model for Breast Lesion Detection in Ultrasound Videos				
012-Paper0202	A Novel Deep Learning System for Breast Lesion Risk Stratification in Ultrasound Images				
013-Paper0975	A Novel Fusion Network for Morphological Analysis of Common Iliac Artery				
014-Paper1405	A Novel Knowledge Keeper Network for 7T-Free But 7T-Guided Brain Tissue Segmentation	based on the checklist, yes.	based on the checklist, yes.		
015-Paper1881	A Penalty Approach for Normalizing Feature Distributions to Build Confounder-Free Models	The code and data can be released according to the reproducibility checklist.		The code and data can be released according to the reproducibility checklist.	
016-Paper2636	A Projection-Based K-space Transformer Network for Undersampled Radial MRI Reconstruction with Limited Training Subjects				
017-Paper0545	A Robust Volumetric Transformer for Accurate 3D Tumor Segmentation				
018-Paper0114	A Self-Guided Framework for Radiology Report Generation				
019-Paper0199	A Sense of Direction in Biomedical Neural Networks				
020-Paper0395	A Spatiotemporal Model for Precise and Efficient Fully-automatic 3D Motion Correction in OCT				
021-Paper0893	A Transformer-Based Iterative Reconstruction Model for Sparse-View CT Reconstruction				
022-Paper0036	AANet: Artery-Aware Network for Pulmonary Embolism Detection in CTPA Images				
023-Paper2394	Accelerated pseudo 3D dynamic speech MR imaging at 3T using unsupervised deep variational manifold learning				
024-Paper2344	Accurate and Explainable Image-based Prediction Using a Lightweight Generative Model				
025-Paper0249	Accurate and Robust Lesion RECIST Diameter Prediction and Segmentation with Transformers				
026-Paper1270	Accurate Corresponding Fiber Tract Segmentation via FiberGeoMap Learner				
027-Paper0159	ACT: Semi-supervised Domain-adaptive Medical Image Segmentation with Asymmetric Co-Training				
028-Paper2509	Adaptation of Surgical Activity Recognition Models Across Operating Rooms				
029-Paper2006	Adapting the Mean Teacher for keypoint-based lung registration under geometric domain shifts				
030-Paper0272	Adaptive 3D Localization of 2D Freehand Ultrasound Brain Images				
031-Paper2848	AdaTriplet: Adaptive Gradient Triplet Loss with Automatic Margin Learning for Forensic Medical Image Matching				
032-Paper1371	Addressing Class Imbalance in Semi-supervised Image Segmentation: A Study on Cardiac MRI				
033-Paper0332	Adversarial Consistency for Single Domain Generalization in Medical Image Segmentation				
034-Paper1829	Adversarially Robust Prototypical Few-shot Segmentation with Neural-ODEs				
035-Paper1248	Agent with Tangent-based Formulation and Anatomical Perception for Standard Plane Localization in 3D Ultrasound				
036-Paper1552	Aggregative Self-Supervised Feature Learning from Limited Medical Images				
037-Paper1305	An Accurate Unsupervised Liver Lesion Detection Method Using Pseudo-Lesions				
038-Paper1415	An adaptive network with extragradient for diffusion MRI-based microstructure estimation				
039-Paper2756	An Advanced Deep Learning Framework for Video-based Diagnosis of ASD				
040-Paper0031	An End-to-End Combinatorial Optimization Method for R-band Chromosome Recognition with Grouping Guided Attention				
041-Paper0049	An Inclusive Task-Aware Framework for Radiology Report Generation				
042-Paper1549	An Optimal Control Problem for Elastic Registration and Force Estimation in Augmented Surgery				
043-Paper1625	Analyzing and Improving Low Dose CT Denoising Network via HU Level Slicing				
044-Paper1703	Analyzing Brain Structural Connectivity as Continuous Random Functions				
045-Paper1726	Anatomy-Guided Weakly-Supervised Abnormality Localization in Chest X-rays				
046-Paper2430	Anomaly-aware multiple instance learning for rare anemia disorder classification				
047-Paper1683	Assessing the Performance of Automated Prediction and Ranking of Patient Age from Chest X-rays Against Clinicians				
048-Paper1796	Asymmetry Disentanglement Network for Interpretable Acute Ischemic Stroke Infarct Segmentation in Non-Contrast CT Scans				
049-Paper2434	Atlas-based Semantic Segmentation of Prostate Zones				
050-Paper0345	Atlas-powered deep learning (ADL) - application to diffusion weighted MRI	Although the architecture is simple (U-Net), the full method is rather complex. Without the code, it seems unlikely one can reproduce the experiments. Although the authors mentioned in the reproducibility checklist that the code was made available, they did not mention it in the paper.	Although the architecture is simple (U-Net), the full method is rather complex. Without the code, it seems unlikely one can reproduce the experiments. Although the authors mentioned in the reproducibility checklist that the code was made available, they did not mention it in the paper.		
051-Paper1798	Attention mechanisms for physiological signal deep learning: which attention should we take?				
052-Paper2482	Attentional Generative Multimodal Network for Neonatal Postoperative Pain Estimation				
053-Paper1971	Attention-enhanced Disentangled Representation Learning for Unsupervised Domain Adaptation in Cardiac Segmentation				
054-Paper0676	Attentive Symmetric Autoencoder for Brain MRI Segmentation				
055-Paper0121	Autofocusing+: Noise-Resilient Motion Correction in Magnetic Resonance Imaging				
056-Paper0386	AutoGAN-Synthesizer: Neural Architecture Search for Cross-Modality MRI Synthesis				
057-Paper1988	AutoLaparo: A New Dataset of Integrated Multi-tasks for Image-guided Surgical Automation in Laparoscopic Hysterectomy				
058-Paper1919	Automated Classification of General Movements in Infants Using Two-stream Spatiotemporal Fusion Network				
059-Paper2247	Automatic Detection of Steatosis in Ultrasound Images with Comparative Visual Labeling				
060-Paper1361	Automatic identification of segmentation errors for radiotherapy using geometric learning				
061-Paper2252	Automatic Segmentation of Hip Osteophytes in DXA Scans using U-Nets	Overall, I consider reproducibility of the study as high. Several remarks below. The exact model architecture is not given explicitly, eventhough it is understandable from the text to some extent. The authors have checked the code release in the checklist, however, there is no link to the source code in the article. Software versions are not specified for the critical components of the pipeline.			Overall, I consider reproducibility of the study as high. Several remarks below. The exact model architecture is not given explicitly, eventhough it is understandable from the text to some extent. The authors have checked the code release in the checklist, however, there is no link to the source code in the article. Software versions are not specified for the critical components of the pipeline.
062-Paper0295	Automating Blastocyst Formation and Quality Prediction in Time-Lapse Imaging with Adaptive Key Frame Selection				
063-Paper2315	Automation of clinical measurements on radiographs of children's hips				
064-Paper1731	BabyNet: Residual Transformer Module for Birth Weight Prediction on Fetal Ultrasound Video				
065-Paper0280	Bayesian dense inverse searching algorithm for real-time stereo matching in minimally invasive surgery				
066-Paper2505	Bayesian Pseudo Labels: Expectation Maximization for Robust and Efficient Semi-Supervised Segmentation				
067-Paper1462	Benchmarking the Robustness of Deep Neural Networks to Common Corruptions in Digital Pathology				
068-Paper2856	BERTHop: An Effective Vision-and-Language Model for Chest X-ray Disease Diagnosis				
069-Paper1459	Bi-directional Encoding for Explicit Centerline Segmentation by Fully-Convolutional Networks	According to the reproducibility checklist, the authors do not plan to provide their training or evaluation code. The method itself is fairly straightforward and well described, and a re-implementation should be possible. Most hyperparameters used for training the models are provided in the supplementary material, however, only the CLIP data set is available for reproducing results.		According to the reproducibility checklist, the authors do not plan to provide their training or evaluation code. The method itself is fairly straightforward and well described, and a re-implementation should be possible. Most hyperparameters used for training the models are provided in the supplementary material, however, only the CLIP data set is available for reproducing results.	
070-Paper1108	BiometryNet: Landmark-based Fetal Biometry Estimation from Standard Ultrasound Planes				
071-Paper1852	BMD-GAN: Bone mineral density estimation using x-ray image decomposition into projections of bone-segmented quantitative computed tomography using hierarchical learning				
072-Paper0820	Boundary-Enhanced Self-Supervised Learning for Brain Structure Segmentation				
073-Paper0016	BoxPolyp: Boost Generalized Polyp Segmentation using Extra Coarse Bounding Box Annotations				
074-Paper2706	Brain-Aware Replacements for Supervised Contrastive Learning in Detection of Alzheimer's Disease				
075-Paper2270	Breaking with Fixed Set Pathology Recognition through Report-Guided Contrastive Training				
076-Paper1095	Building Brains: Subvolume Recombination for Data Augmentation in Large Vessel Occlusion Detection				
077-Paper0239	CACTUSS: Common Anatomical CT-US Space for US examinations	The authors reference the US simulation algorithm and CUT network and provide parameters for each. As noted in their checklist code is not provided . Overall this limits reproducibility of their work. It would be of great interest to the community if they provided access to their framework to allow others to leverage well-curated CT (or MR?!) datasets for US applications.		The authors reference the US simulation algorithm and CUT network and provide parameters for each. As noted in their checklist code is not provided . Overall this limits reproducibility of their work. It would be of great interest to the community if they provided access to their framework to allow others to leverage well-curated CT (or MR?!) datasets for US applications.	
078-Paper0017	Calibrating Label Distribution for Class-Imbalanced Barely-Supervised Knee Segmentation				
079-Paper0963	Calibration of Medical Imaging Classification Systems with Weight Scaling				
080-Paper1145	Camera Adaptation for Fundus-Image-Based CVD Risk Estimation				
081-Paper2332	Capturing Shape Information with Multi-Scale Topological Loss Terms for 3D Reconstruction				
082-Paper2156	Carbon Footprint of Selecting and Training Deep Learning Models for Medical Image Analysis				
083-Paper0783	CaRTS: Causality-driven Robot Tool Segmentation from Vision and Kinematics Data				
084-Paper1369	CASHformer: Cognition Aware SHape Transformer for Longitudinal Analysis	All parts of the model architecture blocks are well described as well as the training procedure (mostly in the supplementary materials). The dataset is exhaustively detailed as well as the splits and the proposed evaluation process. As stated in the reproducibility checklist, not all hyper-parameters tuning / setting is reported, e.g. the loss weight lambda was empirically set.		All parts of the model architecture blocks are well described as well as the training procedure (mostly in the supplementary materials). The dataset is exhaustively detailed as well as the splits and the proposed evaluation process. As stated in the reproducibility checklist, not all hyper-parameters tuning / setting is reported, e.g. the loss weight lambda was empirically set.	
085-Paper0894	Censor-aware Semi-supervised Learning for Survival Time Prediction from Medical Images				
086-Paper0497	CephalFormer: Incorporating Global Structure Constraint into Visual Features for General Cephalometric Landmark Detection				
087-Paper2197	Cerebral Microbleeds Detection Using a 3D Feature Fused Region Proposal Network with Hard Sample Prototype Learning				
088-Paper0402	CFDA: Collaborative Feature Disentanglement and Augmentation for Pulmonary Airway Tree Modeling of COVID-19 CTs				
089-Paper1601	Characterization of brain activity patterns across states of consciousness based on variational auto-encoders	The paper meet the crieria on the checklist.			The paper meet the crieria on the checklist.
090-Paper1593	CheXRelNet: An Anatomy-Aware Model for Tracking Longitudinal Relationships between Chest X-Rays				
091-Paper1588	ChrSNet: Chromosome Straightening using Self-attention Guided Networks				
092-Paper2297	CIRDataset: A large-scale Dataset for Clinically-Interpretable lung nodule Radiomics and malignancy prediction	Apparently, the authors have not understood how to fill out the checklist: all questions are answered with yes, yet most of the information is missing in the paper (e.g. only everage values are given for comparison and no variation, no tests for statistical significance, ...) On a positive note, datasets and code will be released, which should answer many of the open questions.			Apparently, the authors have not understood how to fill out the checklist: all questions are answered with yes, yet most of the information is missing in the paper (e.g. only everage values are given for comparison and no variation, no tests for statistical significance, ...) On a positive note, datasets and code will be released, which should answer many of the open questions.
093-Paper1320	Class Impression for Data-free Incremental Learning				
094-Paper1363	Classification-aided High-quality PET Image Synthesis via Bidirectional Contrastive GAN with Shared Information Maximization				
095-Paper0431	Clinical-realistic Annotation for Histopathology Images with Probabilistic Semi-supervision: A Worst-case Study	More details about each training step, e.g., pre-training, fine-tuning, MC dropout configuration, need to be clarified for reproducibility. The authors checked almost all boxes in the checklist, in which it says the code would be made available. If that is the case, reproducibility is not an issue.		More details about each training step, e.g., pre-training, fine-tuning, MC dropout configuration, need to be clarified for reproducibility. The authors checked almost all boxes in the checklist, in which it says the code would be made available. If that is the case, reproducibility is not an issue.	
096-Paper2314	CLTS-GAN: Color-Lighting-Texture-Specular Reflection Augmentation for Colonoscopy				
097-Paper0726	Collaborative Quantization Embeddings for Intra-Subject Prostate MR Image Registration				
098-Paper0779	Combining mixed-format labels for AI-based pathology detection pipeline in a large-scale knee MRI study	Overall, very high reproducibiliy score. The checklist provided by the authors is in a agreement with the provided details. Few aspects regarding the private dataset and the data management are to be clarified. See the comments in next section.			Overall, very high reproducibiliy score. The checklist provided by the authors is in a agreement with the provided details. Few aspects regarding the private dataset and the data management are to be clarified. See the comments in next section.
099-Paper2128	Combining multiple atlases to estimate data-driven mappings between functional connectomes using optimal transport				
100-Paper1882	Computer-aided Tuberculosis Diagnosis with Attribute Reasoning Assistance				
101-Paper0377	Conditional Generative Data Augmentation for Clinical Audio Datasets				
102-Paper1704	Conditional VAEs for confound removal and normative modelling of neurodegenerative diseases				
103-Paper2792	Consistency-based Semi-supervised Evidential Active Learning for Diagnostic Radiograph Classification				
104-Paper0744	Consistency-preserving Visual Question Answering in Medical Imaging				
105-Paper0772	Context-Aware Transformers For Spinal Cancer Detection and Radiological Grading				
106-Paper0991	Context-aware Voxel-wise Contrastive Learning for Label Efficient Multi-organ Segmentation				
107-Paper1211	ConTrans: Improving Transformer with Convolutional Attention for Medical Image Segmentation				
108-Paper0616	ContraReg: Contrastive Learning of Multi-modality Unsupervised Deformable Image Registration				
109-Paper1057	Contrast-free Liver Tumor Detection using Ternary Knowledge Transferred Teacher-student Deep Reinforcement Learning	Most reproducibility checklist are fulfilled.	Most reproducibility checklist are fulfilled.		
110-Paper0148	Contrastive Functional Connectivity Graph Learning for Population-based fMRI Classification				
111-Paper1698	Contrastive learning for echocardiographic view integration				
112-Paper1582	Contrastive Masked Transformers for Forecasting Renal Transplant Function				
113-Paper1027	Contrastive Re-localization and History Distillation in Federated CMR Segmentation				
114-Paper0573	Contrastive Transformer-based Multiple Instance Learning for Weakly Supervised Polyp Frame Detection				
115-Paper0458	Coronary R-CNN: Vessel-wise Method for Coronary Artery Lesion Detection and Analysis in Coronary CT Angiography				
116-Paper2123	CorticalFlow++: Boosting Cortical Surface Reconstruction Accuracy, Regularity, and Interoperability				
117-Paper0775	CRISP - Reliable Uncertainty Estimation for Medical Image Segmentation				
118-Paper0133	CS2: A Controllable and Simultaneous Synthesizer of Images and Annotations with Minimal Human Intervention				
119-Paper0756	Curvature-enhanced Implicit Function Network for High-quality Tooth Model Generation from CBCT Images	I have some concerns about the reproducibility of the paper. The implementation and technical details of the method are not given in the paper. In the checklist, they claim that they will publish the data, training code, and network model. However, this information is not given in the text.			I have some concerns about the reproducibility of the paper. The implementation and technical details of the method are not given in the paper. In the checklist, they claim that they will publish the data, training code, and network model. However, this information is not given in the text.
120-Paper0539	DA-Net: Dual Branch Transformer and Adaptive Strip Upsampling for Retinal Vessels Segmentation				
121-Paper0233	D'ARTAGNAN: Counterfactual Video Generation				
122-Paper1816	Data-Driven Deep Supervision for Skin Lesion Classification				
123-Paper1296	Data-driven Multi-Modal Partial Medical Image Preregistration by Template Space Patch Mapping				
124-Paper2698	DDPNet: A novel dual-domain parallel network for low-dose CT reconstruction				
125-Paper0688	Decoding Task Sub-type States with Group Deep Bidirectional Recurrent Neural Network				
126-Paper0406	Decoupling Predictions in Distributed Learning for Multi-Center Left Atrial MRI Segmentation				
127-Paper1750	Deep filter bank regression for super-resolution of anisotropic MR brain images				
128-Paper2496	Deep Geometric Supervision Improves Spatial Generalization in Orthopedic Surgery Planning				
129-Paper0636	Deep is a Luxury We Don't Have				
130-Paper1440	Deep Laparoscopic Stereo Matching with Transformers				
131-Paper2581	Deep Learning based Modality-Independent Intracranial Aneurysm Detection				
132-Paper0144	Deep Learning-based Facial Appearance Simulation Driven by Surgically Planned Craniomaxillofacial Bony Movement	The paper provides many details on their implementation, hence there is no major reason to argue about paper reproducibility. Authors report the different hyperparameters used (both in the data processing phase and network training and evaluation phase). Details on the dimension of each modules of the architecture are also provided. Although authors declared that they shared dataset and code in the reproducibility checklist, I do not see any link to such resources in the paper. I would expect that authors share their implementations upon acceptance.		The paper provides many details on their implementation, hence there is no major reason to argue about paper reproducibility. Authors report the different hyperparameters used (both in the data processing phase and network training and evaluation phase). Details on the dimension of each modules of the architecture are also provided. Although authors declared that they shared dataset and code in the reproducibility checklist, I do not see any link to such resources in the paper. I would expect that authors share their implementations upon acceptance.	
133-Paper1387	Deep learning-based Head and Neck Radiotherapy Planning Dose Prediction via Beam-wise Dose Decomposition	Seems okay since author promised to provide the data and code in the reproducibility checklist. Otherwise, it is unclear to say since some key network architecture details are not provided in the paper itself.	"The authors have essentially answered ""yes"" to every question in the reproducibility checklist. However, in reality most of the relevant points have not been included in the manuscript. While not all raised questions can be addressed in the manuscript, the checklist should be filled out correctly. I believe the most interesting information to add to the manuscript would be how the proposed method's hyperparameters were tuned (especially the loss function hyperparameters alpha and beta), how the baselines were implemented and tuned and additional discussion of the clinical significance (see comments above)."	Seems okay since author promised to provide the data and code in the reproducibility checklist. Otherwise, it is unclear to say since some key network architecture details are not provided in the paper itself.	
134-Paper1226	Deep Motion Network for Freehand 3D Ultrasound Reconstruction				
135-Paper2703	Deep Multimodal Guidance for Medical Image Classification				
136-Paper2262	Deep Regression with Spatial-Frequency Feature Coupling and Image Synthesis for Robot-Assisted Endomicroscopy				
137-Paper2350	Deep Reinforcement Learning for Detection of Inner Ear Abnormal Anatomy in Computed Tomography				
138-Paper2325	Deep Reinforcement Learning for Small Bowel Path Tracking using Different Types of Annotations				
139-Paper0232	Deep treatment response assessment and prediction of colorectal cancer liver metastases				
140-Paper0637	DeepCRC: Colorectum and Colorectal Cancer Segmentation in CT Scans via Deep Colorectal Coordinate Transform				
141-Paper0970	Deep-learning Based T1 and T2 Quantification from Undersampled Magnetic Resonance Fingerprinting Data to Track Tracer Kinetics in Small Laboratory Animals	The checklist mentions the code will not be available in a repository as it is still under development, which limits reproducibility.		The checklist mentions the code will not be available in a repository as it is still under development, which limits reproducibility.	The checklist states that the dataset is downloadable, but I did not see an (anonymized) link in the manuscript Same for code and models The exact architecture of the UNet (number of features per layer) is not provided.  Not a problem if code is released. Hyper-parameter strategy is not mentioned, but maybe no hyper-parameter search was performed (which would be fine) Time/cost/memory not reported No statistical significance tests
142-Paper2133	DeepMIF: Deep learning based cell profiling for multispectral immunofluorescence images with graphical user interface	The reproducibility of the paper is good. The authors provided necessary details from the reproducibility checklist.			The reproducibility of the paper is good. The authors provided necessary details from the reproducibility checklist.
143-Paper1080	DeepPyramid: Enabling Pyramid View and Deformable Pyramid Reception for Semantic Segmentation in Cataract Surgery Videos				
144-Paper0626	DeepRecon: Joint 2D Cardiac Segmentation and 3D Volume Reconstruction via A Structure-Specific Generative Method	Good, the author's answers to the reproducibility checklist correspond to the content of their paper.	Good, the author's answers to the reproducibility checklist correspond to the content of their paper.		
145-Paper1802	Deformer: Towards Displacement Field Learning for Unsupervised Medical Image Registration	Good reproducibility. Many technical details of the proposed method are reported and the authors claimed that the code will release if the work is accepted in the reproducibility checklist.	Good reproducibility. Many technical details of the proposed method are reported and the authors claimed that the code will release if the work is accepted in the reproducibility checklist.		
146-Paper0151	Degradation-invariant Enhancement of Fundus Images via Pyramid Constraint Network				
147-Paper0429	Delving into Local Features for Open-Set Domain Adaptation in Fundus Image Analysis				
148-Paper0702	Denoising for Relaxing: Unsupervised Domain Adaptive Fundus Image Segmentation without Source Data				
