id	title	repro	review 1	review 3	review 2
149-Paper0796	Denoising of 3D MR images using a voxel-wise hybrid residual MLP-CNN model to improve small lesion diagnostic confidence				
150-Paper0632	DentalPointNet: Landmark Localization on High-Resolution 3D Digital Dental Models				
151-Paper0408	DeSD: Self-Supervised Learning with Deep Self-Distillation for 3D Medical Image Segmentation				
152-Paper1127	DeStripe: A Self2Self Spatio-Spectral Graph Neural Network with Unfolded Hessian for Stripe Artifact Removal in Light-sheet Microscopy				
153-Paper1579	Detecting Aortic Valve Pathology from the 3-Chamber Cine Cardiac MRI View				
154-Paper1426	DEUE: Delta Ensemble Uncertainty Estimation for a More Robust Estimation of Ejection Fraction				
155-Paper0164	DGMIL: Distribution Guided Multiple Instance Learning for Whole Slide Image Classification	The authors have clarified that the code will be available in the reproducibility checklist.	The authors have clarified that the code will be available in the reproducibility checklist.		
156-Paper0682	Did You Get What You Paid For? Rethinking Annotation Cost of Deep Learning Based Computer Aided Detection in Chest Radiographs				
157-Paper0467	Diffusion Deformable Model for 4D Temporal Medical Image Generation				
158-Paper0704	Diffusion Models for Medical Anomaly Detection				
159-Paper1952	Digestive Organ Recognition in Video Capsule Endoscopy based on Temporal Segmentation Network				
160-Paper1447	Discrepancy and Gradient-guided Multi-Modal Knowledge Distillation for Pathological Glioma Grading				
161-Paper0659	Discrepancy-based Active Learning for Weakly Supervised Bleeding Segmentation in Wireless Capsule Endoscopy Images				
162-Paper0353	Disentangle then Calibrate: Selective Treasure Sharing for Generalized Rare Disease Diagnosis				
163-Paper2193	DisQ: Disentangling Quantitative MRI Mapping of the Heart	The manuscript mentions the code will be available in a repository and the checklist supports this statement. There are some little details not explained in the paper, but it may be out of the scope of a conference paper. Once uploaded, it will guarantee reproducibility.			The manuscript mentions the code will be available in a repository and the checklist supports this statement. There are some little details not explained in the paper, but it may be out of the scope of a conference paper. Once uploaded, it will guarantee reproducibility.
164-Paper0323	Distilling Knowledge from Topological Representations for Pathological Complete Response Prediction				
165-Paper1029	Domain Adaptive Mitochondria Segmentation via Enforcing Inter-Section Consistency				
166-Paper1242	Domain Adaptive Nuclei Instance Segmentation and Classification via Category-aware Feature Alignment and Pseudo-labelling	The authors do not provide the description of results with central tendency (e.g. mean) & variation in the paper, which they answered Yes in the checklist. It would be a plus to add mean and variance to the results.	The authors do not provide the description of results with central tendency (e.g. mean) & variation in the paper, which they answered Yes in the checklist. It would be a plus to add mean and variance to the results.		
167-Paper0127	Domain Specific Convolution and High Frequency Reconstruction based Unsupervised Domain Adaptation for Medical Image Segmentation				
168-Paper1315	Domain-Adaptive 3D Medical Image Synthesis: An Efficient Unsupervised Approach				
169-Paper0992	Domain-Prior-Induced Structural MRI Adaptation for Clinical Progression Prediction of Subjective Cognitive Decline				
170-Paper1693	DOMINO: Domain-aware Model Calibration in Medical Image Segmentation				
171-Paper0021	Double-Uncertainty Guided Spatial and Temporal Consistency Regularization Weighting for Learning-based Abdominal Registration				
172-Paper1456	DRGen: Domain Generalization in Diabetic Retinopathy Classification				
173-Paper1510	DS3-Net: Difficulty-perceived Common-to-T1ce Semi-Supervised Multimodal MRI Synthesis Network				
174-Paper0950	DSP-Net: Deeply-Supervised Pseudo-Siamese Network for Dynamic Angiographic Image Matching				
175-Paper1389	DSR: Direct Simultaneous Registration for Multiple 3D Images				
176-Paper0333	Dual-Branch Squeeze-Fusion-Excitation Module for Cross-Modality Registration of Cardiac SPECT and CT				
177-Paper0838	Dual-Distribution Discrepancy for Anomaly Detection in Chest X-Rays				
178-Paper1476	Dual-graph Learning Convolutional Networks for Interpretable Alzheimer's Disease Diagnosis				
179-Paper1430	Dual-HINet: Dual Hierarchical Integration Network of Multigraphs for Connectional Brain Template Learning				
180-Paper1066	DuDoCAF: Dual-Domain Cross-Attention Fusion with Recurrent Transformer for Fast Multi-contrast MR Imaging				
181-Paper0434	Dynamic Bank Learning for Semi-supervised Federated Image Diagnosis with Class Imbalance				
182-Paper2304	EchoCoTr: Estimation of the Left Ventricular Ejection Fraction from Spatiotemporal Echocardiography				
183-Paper1732	EchoGNN: Explainable Ejection Fraction Estimation with Graph Neural Networks				
184-Paper0300	Edge-oriented Point-cloud Transformer for 3D Intracranial Aneurysm Segmentation				
185-Paper1159	Effective Opportunistic Esophageal Cancer Screening using Noncontrast CT Imaging				
186-Paper2172	Efficient Bayesian Uncertainty Estimation for nnU-Net				
187-Paper0368	Efficient Biomedical Instance Segmentation via Knowledge Distillation	Some details are missing. The authors seems just check everything 'yes' in the checklist. Missing one of the loss function definition. Missing software framework and version. No new dataset proposed. Missing training time for the proposed distillation method.		Some details are missing. The authors seems just check everything 'yes' in the checklist. Missing one of the loss function definition. Missing software framework and version. No new dataset proposed. Missing training time for the proposed distillation method.	
188-Paper2377	Efficient population based hyperparameter scheduling for medical image segmentation				
189-Paper2746	Electron Microscope Image Registration using Laplacian Sharpening Transformer U-Net	use of public challenge data unclear if code is to be made available no significance testing (not claimed in checklist but unclear why not carried out)	use of public challenge data unclear if code is to be made available no significance testing (not claimed in checklist but unclear why not carried out)		
190-Paper0420	Embedding Gradient-based Optimization in Image Registration Networks				
191-Paper1872	Embedding Human Brain Function via Transformer				
192-Paper1262	End-to-End cell recognition by point annotation				
193-Paper0791	End-to-End Evidential-Efficient Net for Radiomics Analysis of Brain MRI to Predict Oncogene Expression and Overall Survival				
194-Paper0506	End-to-end Learning for Image-based Detection of Molecular Alterations in Digital Pathology				
195-Paper2010	End-to-end Multi-Slice-to-Volume Concurrent Registration and Multimodal Generation				
196-Paper1271	End-to-End Segmentation of Medical Images via Patch-wise Polygons Prediction	Some details are missing. The authors seems just check everything 'yes' in the checklist. Missing one of the loss function definition, i.e. L_{BCE}. Missing software framework and version. No new dataset proposed. Missing training time for the proposed network.		Some details are missing. The authors seems just check everything 'yes' in the checklist. Missing one of the loss function definition, i.e. L_{BCE}. Missing software framework and version. No new dataset proposed. Missing training time for the proposed network.	
197-Paper2651	Enforcing connectivity of 3D linear structures using their 2D projections	Apparently, the authors have not understood how to fill out the checklist: for many questions answered with yes, the information is actually missing in the paper (e.g. no tests for statistical significance, memory footprint, analysis of situations in which the method failed, etc.). Since no code will be published, these details will remain unknown.			Apparently, the authors have not understood how to fill out the checklist: for many questions answered with yes, the information is actually missing in the paper (e.g. no tests for statistical significance, memory footprint, analysis of situations in which the method failed, etc.). Since no code will be published, these details will remain unknown.
198-Paper1940	Enhancing model generalization for substantia nigra segmentation using a test-time normalization-based method				
199-Paper1749	Ensembled Prediction of Rheumatic Heart Disease from Ungated Doppler Echocardiography Acquired in Low-Resource Settings	The authors filled out the reproducibility checklists, but will not release their codes and dataset in the future. Then implementation details of all models in the paper are well described. It is easy to follow the paper and reproduce their work.	"Overall reasonably good. The model was clearly described although code has not been made available. One point of concern though - in the checklist, the authors answered ""Yes"" to ""The range of hyper-parameters considered, method to select the best hyper-parameter configuration, and specification of all hyper-parameters used to generate results."" I agree that they specified final hyperparameter values but I did not see any description of the range of values tested or how the hyperparameters were optimised (see detailed comments below)."	The authors filled out the reproducibility checklists, but will not release their codes and dataset in the future. Then implementation details of all models in the paper are well described. It is easy to follow the paper and reproduce their work.	
200-Paper0439	Estimating Model Performance under Domain Shifts with Class-Specific Confidence Scores				
201-Paper1563	Evidence fusion with contextual discounting for multi-modality medical image segmentation				
202-Paper0960	Evolutionary Multi-objective Architecture Search Framework: Application to COVID-19 3D CT Classification				
203-Paper1856	Explainable Contrastive Multiview Graph Representation of Brain, Mind, and Behavior				
204-Paper2558	Explaining Chest X-ray Pathologies in Natural Language				
205-Paper0081	Exploring Smoothness and Class-Separation for Semi-supervised Medical Image Segmentation				
206-Paper2742	Extended Electrophysiological Source Imaging with Spatial Graph Filters				
207-Paper2316	FairPrune: Achieving Fairness Through Pruning for Dermatological Disease Diagnosis				
208-Paper2313	Fast Automatic Liver Tumor Radiofrequency Ablation Planning via Learned Physics Model				
209-Paper2730	Fast FF-to-FFPE Whole Slide Image Translation via Laplacian Pyramid and Contrastive Learning				
210-Paper2428	Fast Spherical Mapping of Cortical Surface Meshes using Deep Unsupervised Learning	The paper meets the requirements of the checklist.		The paper meets the requirements of the checklist.	
211-Paper1680	Fast Unsupervised Brain Anomaly Detection and Segmentation with Diffusion Models	While the code is not publicly available (and the reproducibility checklist says so), I believe the authors might have used the original repositories for VQ-VAE and DDPM which are publicly available. Even though implementation details are not given, it might be possible to reproduce the method partially. Furthermore, the results are presented using public datasets.		While the code is not publicly available (and the reproducibility checklist says so), I believe the authors might have used the original repositories for VQ-VAE and DDPM which are publicly available. Even though implementation details are not given, it might be possible to reproduce the method partially. Furthermore, the results are presented using public datasets.	
212-Paper2777	Feature Re-calibration based Multiple Instance Learning for Whole Slide Image Classification				
213-Paper2407	Feature robustness and sex differences in medical imaging: a case study in MRI-based Alzheimer's disease detection				
214-Paper2425	Federated Medical Image Analysis with Virtual Sample Synthesis	All questions in the reproducibility checklist are positive and implementation details are given in the paper.		All questions in the reproducibility checklist are positive and implementation details are given in the paper.	
215-Paper0107	Federated Stain Normalization for Computational Pathology				
216-Paper1639	FedHarmony: Unlearning Scanner Bias with Distributed Data				
217-Paper0905	Few-shot Generation of Personalized Neural Surrogates for Cardiac Simulation via Bayesian Meta-Learning				
218-Paper0176	Few-shot Medical Image Segmentation Regularized with Self-reference and Contrastive Learning				
219-Paper0530	FFCNet: Fourier Transform-Based Frequency Learning and Complex Convolutional Network for Colon Disease Classification				
220-Paper1280	Fine-grained Correlation Loss for Regression	According to the checklist, the authors will opensource their codes in the future. In the paper, the authors also provide enough details for reproduction.		According to the checklist, the authors will opensource their codes in the future. In the paper, the authors also provide enough details for reproduction.	In the reproducibility checklist, the authors mentioned that the code has been made available or will release if this work is accepted. I think it is great if they release the code if this work is accepted. Unfortunately, there are no details regarding how the authors acquired data. I assume that the dataset was dedicated to this study since there are no citations or download links. If it is the case, it can be mentioned in the manuscript explicitly. The validations seem well-documented except for concern regarding the reported batch size, which has been explained in detail in the comments.
221-Paper0464	Flat-aware Cross-stage Distilled Framework for Imbalanced Medical Image Classification	Good. Experiments were performed on public datasets and the authors plan to release code after peer-review according to the checklist.			Good. Experiments were performed on public datasets and the authors plan to release code after peer-review according to the checklist.
222-Paper0166	Flexible Sampling for Long-tailed Skin Lesion Classification				
223-Paper1037	fMRI Neurofeedback Learning Patterns are Predictive of Personal and Clinical Traits				
224-Paper0656	Free Lunch for Surgical Video Understanding by Distilling Self-Supervisions				
225-Paper1550	Frequency-Aware Inverse-Consistent Deep Learning for OCT-Angiogram Super-Resolution				
226-Paper2446	From Images to Probabilistic Anatomical Shapes: A Deep Variational Bottleneck Approach				
227-Paper2489	FSE Compensated Motion Correction for MRI Using Data Driven Methods				
228-Paper2619	Fusing Modalities by Multiplexed Graph Neural Networks for Outcome Prediction in Tuberculosis				
229-Paper0029	FUSSNet: Fusing Two Sources of Uncertainty for Semi-Supervised Medical Image Segmentation				
230-Paper0398	GaitForeMer: Self-Supervised Pre-Training of Transformers via Human Motion Forecasting for Few-Shot Gait Impairment Severity Estimation				
231-Paper2241	GazeRadar: A Gaze and Radiomics-guided Disease Localization Framework				
232-Paper2084	Geometric Constraints for Self-supervised Monocular Depth Estimation on Laparoscopic Images with Dual-task Consistency	The authors have confirmed in the checklist that they will share the code to the public. The dataset used in the work is from a public challenge.	The authors have confirmed in the checklist that they will share the code to the public. The dataset used in the work is from a public challenge.		
233-Paper1173	Gigapixel Whole-Slide Images Classification using Locally Supervised Learning				
234-Paper1622	Global Multi-modal 2D/3D Registration via Local Descriptors Learning				
235-Paper1165	GradMix for nuclei segmentation and classification in imbalanced pathology image datasets				
236-Paper0770	Graph convolutional network with probabilistic spatial regression: application to craniofacial landmark detection from 3D photogrammetry				
237-Paper0826	Graph Emotion Decoding from Visually Evoked Neural Responses				
238-Paper1499	Graph-based Compression of Incomplete 3D Photoacoustic Data				
239-Paper1645	Greedy Optimization of Electrode Arrangement for Epiretinal Prostheses				
240-Paper1177	Hand Hygiene Quality Assessment using Image-to-Image Translation				
241-Paper2141	Harnessing Deep Bladder Tumor Segmentation with Logical Clinical Knowledge				
242-Paper0695	Hierarchical Brain Networks Decomposition via Prior Knowledge Guided Deep Belief Network				
243-Paper2461	Histogram-based unsupervised domain adaptation for medical image classification				
244-Paper2095	How Much to Aggregate: Learning Adaptive Node-wise Scales on Graphs for Brain Networks	According to the reproducibility checklist and information from the paper, the results should be reproducible after the potential acceptance.			According to the reproducibility checklist and information from the paper, the results should be reproducible after the potential acceptance.
245-Paper0053	Hybrid Graph Transformer for Tissue Microstructure Estimation with Undersampled Diffusion MRI Data				
246-Paper1120	Hybrid Spatio-Temporal Transformer Network for Predicting Ischemic Stroke Lesion Outcomes from 4D CT Perfusion Imaging				
247-Paper1527	Ideal Midsagittal Plane Detection using Deep Hough Plane Network for Brain Surgical Planning				
248-Paper1790	Identification of vascular cognitive impairment in adult moyamoya disease via integrated graph convolutional network				
249-Paper1279	Identify Consistent Imaging Genomic Biomarkers for Characterizing the Survival-associated Interactions between Tumor-infiltrating Lymphocytes and Tumors				
250-Paper1422	Identifying and Combating Bias in Segmentation Networks by leveraging multiple resolutions				
251-Paper2056	Identifying Phenotypic Concepts Discriminating Molecular Breast Cancer Sub-Types				
252-Paper0735	Implicit Neural Representations for Generative Modeling of Living Cell Shapes				
253-Paper1642	Implicit Neural Representations for Medical Imaging Segmentation	The source code is available according to the author's answer to the reproducibility checklist.		The source code is available according to the author's answer to the reproducibility checklist.	
254-Paper0867	Improved Domain Generalization for Cell Detection in Histopathology Images via Test-Time Stain Augmentation				
255-Paper2493	Improving Trustworthiness of AI Disease Severity Rating in Medical Imaging with Ordinal Conformal Prediction Sets				
256-Paper2533	Incorporating intratumoral heterogeneity into weakly-supervised deep learning models via variance pooling				
257-Paper0284	INSightR-Net: Interpretable Neural Network for Regression using Similarity-based Comparisons to Prototypical Examples				
258-Paper0807	InsMix: Towards Realistic Generative Data Augmentation for Nuclei Instance Segmentation				
259-Paper0939	Instrument-tissue Interaction Quintuple Detection in Surgery Videos				
260-Paper0943	Interaction-Oriented Feature Decomposition for Medical Image Lesion Detection				
261-Paper2064	Interpretable differential diagnosis for Alzheimer's disease and Frontotemporal dementia				
262-Paper0324	Interpretable Graph Neural Networks for Connectome-Based Brain Disorder Analysis	The submission meets all criteria on the reproducibility checklist.		The submission meets all criteria on the reproducibility checklist.	
263-Paper2611	Interpretable Modeling and Reduction of Unknown Errors in Mechanistic Operators				
264-Paper0742	Interpretable signature of consciousness in resting-state functional network brain activity				
265-Paper1987	Intervention & Interaction Federated Abnormality Detection with Noisy Clients				
266-Paper1938	Intra-class Contrastive Learning Improves Computer Aided Diagnosis of Breast Cancer in Mammography				
267-Paper1542	Invertible Sharpening Network for MRI Reconstruction Enhancement				
268-Paper2202	Is a PET all you need? A multi-modal study for Alzheimer's disease using 3D CNNs				
269-Paper1711	iSegFormer: Interactive Segmentation via Transformers with Application to 3D Knee MR Images				
270-Paper0679	Joint Class-Affinity Loss Correction for Robust Medical Image Segmentation with Noisy Labels				
271-Paper0179	Joint Graph Convolution for Analyzing Brain Structural and Functional Connectome				
272-Paper1464	Joint Modeling of Image and Label Statistics for Enhancing Model Generalizability of Medical Image Segmentation				
273-Paper1557	Joint Prediction of Meningioma Grade and Brain Invasion via Task-Aware Contrastive Learning				
274-Paper2040	Joint Region-Attention and Multi-Scale Transformer for Microsatellite Instability Detection from Whole Slide Images in Gastrointestinal Cancer				
275-Paper1974	Kernel Attention Transformer (KAT) for Histopathology Whole Slide Image Classification				
276-Paper0419	Key-frame Guided Network for Thyroid Nodule Recognition using Ultrasound Videos				
277-Paper0584	Knowledge Distillation to Ensemble Global and Interpretable Prototype-based Mammogram Classification Models	In the reproducibility checklist, the authors claim to release the training/evaluation codes with pretrained models which is a plus. Since the proposed method is a sophisticated ensemble learning framework with multiple loss functions, source code release could be a great help.		In the reproducibility checklist, the authors claim to release the training/evaluation codes with pretrained models which is a plus. Since the proposed method is a sophisticated ensemble learning framework with multiple loss functions, source code release could be a great help.	
278-Paper2211	Landmark-free Statistical Shape Modeling via Neural Flow Deformations				
279-Paper1397	Layer Ensembles: A Single-Pass Uncertainty Estimation in Deep Learning for Segmentation				
280-Paper1555	Learn to Ignore: Domain Adaptation for Multi-Site MRI Analysis				
281-Paper1959	Learning Incrementally to Segment Multiple Organs in a CT Image				
282-Paper2474	Learning iterative optimisation for deformable image registration of lung CT with recurrent convolutional networks				
283-Paper0492	Learning Robust Representation for Joint Grading of Ophthalmic Diseases via Adaptive Curriculum and Feature Disentanglement				
284-Paper1319	Learning self-calibrated optic disc and cup segmentation from multi-rater annotations				
285-Paper2366	Learning shape distributions from large databases of healthy organs: applications to zero-shot and few-shot abnormal pancreas detection				
286-Paper1507	Learning towards Synchronous Network Memorizability and Generalizability for Continual Segmentation across Multiple Sites				
287-Paper0967	Learning Tumor-Induced Deformations to Improve Tumor-Bearing Brain MR Segmentation				
288-Paper1591	Learning Underrepresented Classes from Decentralized Partially Labeled Medical Images				
289-Paper1723	Learning with Context Encoding for Single-Stage Cranial Bone Labeling and Landmark Localization				
290-Paper2333	Learning-based and unrolled motion-compensated reconstruction for cardiac MR CINE imaging				
291-Paper0256	Learning-based US-MR Liver Image Registration with Spatial Priors				
292-Paper1034	Lesion Guided Explainable Few Weak-shot Medical Report Generation	Authors provided a checklist for reproducibility. The description of the methods, implementation and validation studies are also satisfactory.		Authors provided a checklist for reproducibility. The description of the methods, implementation and validation studies are also satisfactory.	
293-Paper1939	Lesion-Aware Contrastive Representation Learning for Histopathology Whole Slide Images Analysis				
294-Paper0847	Lesion-aware Dynamic Kernel for Polyp Segmentation				
295-Paper0586	Less is More: Adaptive Curriculum Learning for Thyroid Nodule Diagnosis				
296-Paper1674	Leveraging Labeling Representations in Uncertainty-based Semi-supervised Segmentation				
297-Paper2800	LIDP: A Lung Image Dataset with Pathological Information for Lung Cancer Screening				
298-Paper2088	LifeLonger: A Benchmark for Continual Disease Classification	The code of the paper will be made available publicly.  From the checklist authors claim that the software framework and runtime/memory footprint statistics are included, however both are not included in the paper.	The code of the paper will be made available publicly.  From the checklist authors claim that the software framework and runtime/memory footprint statistics are included, however both are not included in the paper.		
299-Paper0447	LiftReg: Limited Angle 2D/3D Deformable Registration				
300-Paper2336	Light-weight spatio-temporal graphs for segmentation and ejection fraction prediction in cardiac ultrasound				
301-Paper2383	Local Attention Graph-based Transformer for Multi-target Genetic Alteration Prediction	The reproducibility of the paper is good. The authors provided necessary details from the reproducibility checklist.			The reproducibility of the paper is good. The authors provided necessary details from the reproducibility checklist.
302-Paper0578	Local Graph Fusion of Multi-View MR Images for Knee Osteoarthritis Diagnosis				
303-Paper0919	Localizing the Recurrent Laryngeal Nerve via Ultrasound with a Bayesian Shape Framework				
304-Paper1059	Local-Region and Cross-Dataset Contrastive Learning for Retinal Vessel Segmentation				
305-Paper1649	Longitudinal Infant Functional Connectivity Prediction via Conditional Intensive Triplet Network				
306-Paper2874	Long-tailed Multi-label Retinal Diseases Recognition via Relational Learning and Knowledge Distillation				
307-Paper1411	Low-Dose CT Reconstruction via Dual-Domain Learning and Controllable Modulation				
308-Paper0125	Low-Resource Adversarial Domain Adaptation for Cross-Modality Nucleus Detection				
309-Paper2658	LSSANet: A Long Short Slice-Aware Network for Pulmonary Nodule Detection				
