category		contribution	contribution	contribution	strengths	strengths	strengths	weakness	weakness	weakness	reproducibility	reproducibility	reproducibility	detailed	detailed	detailed	justification	justification	justification
review		review 1	review 2	review 3	review 1	review 2	review 3	review 1	review 2	review 3	review 1	review 2	review 3	review 1	review 2	review 3	review 1	review 2	review 3
id	title																		
001-Paper0829	3D Arterial Segmentation via Single 2D Projections and Depth Supervision in Contrast-Enhanced CT Images	130	140	57	90	102	14	118	159	90	12	161	17	154	174	38	79	52	28
002-Paper1655	3D Dental Mesh Segmentation Using Semantics-Based Feature Learning with Graph-Transformer	43	51	110	44	39	265	33	71	235	8	52	140	19	169	279	48	76	136
003-Paper1307	3D Medical Image Segmentation with Sparse Annotation via Cross-Teaching between 3D and 2D Networks	64	79	59	249	11	81	66	49	33	6	3	3	66	49	4	53	4	43
004-Paper2386	3D Mitochondria Instance Segmentation with Spatio-Temporal Transformers	54	74	82	13	7	50	40	35	114	2	4	22	300	338	148	12	10	124
005-Paper2035	3D Teeth Reconstruction from Panoramic Radiographs using Neural Implicit Functions	32	55	15	40	122	17	14	188	275	5	11	19	101	79	16	29	17	18
006-Paper1808	A Closed-form Solution to Electromagnetic Sensor Based Intraoperative Limb Length Measurement in Total Hip Arthroplasty	63	20	76	65	49	54	221	60	23	75	11	20	221	246	31	27	13	23
007-Paper0976	A Conditional Flow Variational Autoencoder for Controllable Synthesis of Virtual Populations of Anatomy	33	30	96	19	27	39	39	74	81	9	6	12	209	2	54	28	6	27
008-Paper3288	A coupled-mechanisms modelling framework for neurodegeneration	108	129	142	106	34	63	299	75	172	43	28	12	3	6	74	24	20	55
009-Paper1168	A denoised Mean Teacher for domain adaptive point cloud registration	70	159	46	118	36	18	58	27	1	28	128	3	12	671	23	66	55	27
010-Paper1779	A flexible framework for simulating and evaluating biases in deep learning-based medical image analysis	40	32	55	70	82	41	84	336	100	5	18	16	425	180	167	65	75	30
011-Paper0286	A General Stitching Solution for Whole-Brain 3D Nuclei Instance Segmentation from Microscopy Images	62	27	36	43	16	30	10	7	38	5	4	4	193	224	57	58	12	61
012-Paper1873	A Model-Agnostic Framework for Universal Anomaly Detection of Multi-Organ and Multi-Modal Images	150	39	58	49	90	70	102	52	87	37	19	9	67	136	6	7	26	30
013-Paper1912	A Modulatory Elongated Model for Delineating Retinal Microvasculature in OCTA Images	31	78	81	34	36	37	23	68	398	34	15	19	174	81	58	34	25	57
014-Paper0643	A Motion Transformer for Single Particle Tracking in Fluorescence Microscopy Images	59	39	108	86	31	58	457	30	172	12	28	1	66	27	72	13	18	43
015-Paper2184	A Multimodal Disease Progression Model for Genetic Associations with Disease Dynamics	46	145	81	33	29	27	44	241	16	1	40	2	347	58	152	17	40	4
016-Paper1115	A Multi-Task Method for Immunofixation Electrophoresis Image Classification	63	31	73	45	13	53	20	38	41	15	19	31	72	98	221	9	52	32
017-Paper2273	A Multi-Task Network for Anatomy Identification in Endoscopic Pituitary Surgery	16	73	138	20	97	32	17	68	73	19	40	22	142	148	300	50	31	71
018-Paper1457	A Novel Multi-Task Model Imitating Dermatologists for Accurate Differential Diagnosis of Skin Diseases in Clinical Images	47	27	45	48	39	40	27	22	73	26	18	5	63	22	18	38	31	38
019-Paper0813	A Novel Video-CTU Registration Method with Structural Point Similarity for FURS Navigation	56	85	18	78	55	12	69	16	39	14	1	14	303	211	179	21	14	9
020-Paper2659	A One-class Variational Autoencoder (OCVAE) cascade for classifying atypical bone marrow cell sub-types	89	43	55	91	33	63	159	44	98	48	16	15	170	127	112	7	11	108
021-Paper2349	A Patient-Specific Self-supervised Model for Automatic X-ray/CT Registration	50	142	52	78	57	76	309	160	50	22	15	28	65	210	35	60	18	89
022-Paper3224	A Privacy-Preserving Walk in the Latent Space of Generative Models for Medical Applications	44	46	42	86	69	52	3	138	128	7	13	22	28	37	38	36	13	34
023-Paper0753	A Reliable and Interpretable Framework of Multi-view Learning for Liver Fibrosis Staging	74	55	62	31	43	72	38	14	26	15	3	7	54	124	45	24	70	11
024-Paper1104	A Semantic-guided and Knowledge-based Generative Framework for Orthodontic Visual Outcome Preview	33	37	59	22	49	94	27	84	169	17	11	14	34	72	161	3	22	77
025-Paper1008	A Sheaf Theoretic Perspective for Robust Prostate Segmentation	73	53	66	26	54	99	54	83	206	5	20	27	1	374	65	7	28	50
026-Paper2327	A Small-Sample Method with EEG Signals Based on Abductive Learning for Motor Imagery Decoding	35	31	95	15	32	79	61	13	45	7	12	11	9	38	52	61	17	12
027-Paper1755	A Spatial-Temporal Deformable Attention based Framework for Breast Lesion Detection in Videos	35	37	30	42	18	38	27	41	38	15	12	28	86	231	108	13	94	39
028-Paper2027	A Spatial-Temporally Adaptive PINN Framework for 3D Bi-Ventricular Electrophysiological Simulations and Parameter Inference	105	56	144	39	160	39	99	107	242	70	8	38	10	73	221	1	42	83
029-Paper0501	A Style Transfer-based Augmentation Framework for Improving Segmentation and Classification Performance across Different Sources in Ultrasound Images	40	84	14	42	181	13	146	201	36	191	60	13	64	231	26	46	1	12
030-Paper3722	A Texture Neural Network to Predict the Abnormal Brachial Plexus from Routine Magnetic Resonance Imaging	30	43	46	52	35	48	5	121	29	37	12	10	26	2	60	23	28	18
031-Paper1001	A Transfer Learning Approach to Localise a Deep Brain Stimulation Target	50	81	45	111	30	40	106	55	109	24	29	22	43	205	5	21	43	19
032-Paper1827	A Unified Deep-Learning-Based Framework for Cochlear Implant Electrode Array Localization	20	32	92	32	60	95	293	252	6	10	3	27	149	2	199	15	20	47
033-Paper2320	A Video-based End-to-end Pipeline for Non-nutritive Sucking Action Recognition and Segmentation in Young Infants	40	62	17	47	12	59	110	85	47	17	49	23	415	34	46	71	74	26
034-Paper2791	A2FSeg: Adaptive Multi-Modal Fusion Network for Medical Image Segmentation	53	40	92	32	20	24	72	103	261	3	14	2	31	103	4	29	23	4
035-Paper2655	ACC-UNet: A Completely Convolutional UNet model for the 2020s	19	23	105	26	41	94	72	21	60	11	27	54	65	49	144	18	34	39
036-Paper2373	Accurate and Robust Patient Height and Weight Estimation in Clinical Imaging using a Depth Camera	24	128	39	31	98	25	200	51	64	13	44	14	5	332	150	36	48	25
037-Paper1541	Accurate multi-contrast MRI super-resolution via a dual cross-attention transformer network	69	88	28	64	31	55	103	49	46	7	48	61	135	100	100	42	37	53
038-Paper0867	ACTION++: Improving Semi-supervised Medical Image Segmentation with Adaptive Anatomical Contrast	82	37	78	94	50	45	380	35	15	20	6	7	133	15	11	26	9	45
039-Paper1160	ACT-Net: Anchor-context Action Detection in Surgery Videos	75	32	72	66	58	83	66	150	91	23	20	9	149	85	104	43	26	51
040-Paper2061	Acute Ischemic Stroke Onset Time Classification with Dynamic Convolution and Perfusion Maps Fusion	50	117	43	55	159	133	154	135	232	44	36	44	45	758	346	60	75	17
041-Paper1499	Adapter Learning in Pretrained Feature Extractor for Continual Learning of Diseases	59	105	34	23	76	38	140	137	55	15	4	30	63	200	72	5	37	3
042-Paper2125	Adaptive Multi-scale Online Likelihood Network for AI-assisted Interactive Segmentation	111	83	124	82	36	229	49	27	259	14	19	32	205	20	356	64	43	141
043-Paper1681	Adaptive Region Selection for Active Learning in Whole Slide Image Semantic Segmentation	33	42	47	71	26	70	176	117	99	16	43	32	176	4	121	6	83	75
044-Paper1894	Adaptive Supervised PatchNCE Loss for Learning H&E-to-IHC Stain Translation with Inconsistent Groundtruth Image Pairs	43	49	114	45	36	62	35	41	199	19	13	12	34	97	5	11	8	8
045-Paper0722	Additional Positive Enables Better Representation Learning for Medical Images	59	34	75	47	13	59	54	10	162	12	13	47	95	542	153	34	5	45
046-Paper1865	Adjustable Robust Transformer for High Myopia Screening in Optical Coherence Tomography	60	21	37	95	44	14	145	48	90	7	4	11	79	5	113	51	8	21
047-Paper0340	Adult-like Phase and Multi-scale Assistance for Isointense Infant Brain Tissue Segmentation	64	85	110	27	42	49	194	109	133	8	18	29	57	41	260	8	21	59
048-Paper1475	AirwayFormer: Structure-Aware Boundary-Adaptive Transformers for Airway Anatomical Labeling	77	144	55	126	52	16	28	77	48	9	33	19	80	611	49	23	16	36
049-Paper0690	Alias-Free Co-Modulated Network for Cross-Modality Synthesis and Super-Resolution of MR Images	44	61	117	41	28	30	24	53	103	5	5	20	86	4	72	5	78	31
050-Paper2820	ALL-IN: A Local GLobal Graph-based DIstillatioN Model for Representation Learning of Gigapixel Histopathology Images With Application In Cancer Risk Assessment	45	50	43	45	78	63	61	206	37	23	19	1	35	59	228	10	12	31
051-Paper1205	AMAE: Adaptation of Pre-Trained Masked Autoencoder for Dual-Distribution Anomaly Detection in Chest X-Rays	29	48	49	52	24	2	57	132	185	36	28	3	28	3	52	55	3	5
052-Paper0989	AME-CAM: Attentive Multiple-Exit CAM for Weakly Supervised Segmentation on MRI Brain Tumor	66	54	16	40	133	31	64	124	18	10	27	4	244	84	34	16	33	13
053-Paper2596	An AI-Ready Multiplex Staining Dataset for Reproducible and Accurate Characterization of Tumor Immune Microenvironment	38	40	12	18	74	3	17	336	5	2	10	22	89	179	44	29	121	6
054-Paper1278	An Anti-Biased TBSRTC-Category Aware Nuclei Segmentation Framework with A Multi-Label Thyroid Cytology Benchmark	59	66	44	116	24	17	77	42	123	17	9	23	46	44	15	59	14	26
055-Paper2173	An Auto-Encoder to Reconstruct Structure with Cryo-EM Images via Theoretically Guaranteed Isometric Latent Space, and its Application for Automatically Computing the Conformational Pathway	37	147	12	32	71	30	17	165	400	3	4	3	17	181	9	14	49	48
056-Paper2970	An automated pipeline for quantitative T2* fetal body MRI and segmentation at low field	90	87	16	24	83	46	39	134	96	75	10	7	23	125	107	39	14	6
057-Paper0599	An Explainable Deep Framework: Towards Task-Specific Fusion for Multi-to-One MRI Synthesis	66	57	67	136	102	80	398	155	216	23	27	7	417	52	191	97	14	22
058-Paper3214	An Explainable Geometric-Weighted Graph Attention Network for Identifying Functional Networks Associated with Gait Impairment	74	42	110	40	35	219	89	80	57	11	10	3	327	2	142	33	17	35
059-Paper3355	An Interpretable and Attention-based Method for Gaze Estimation Using Electroencephalography	30	19	83	9	30	46	11	12	165	29	17	11	22	3	205	24	20	23
060-Paper1858	An Unsupervised Multispectral Image Registration Network for Skin Diseases	136	57	32	37	159	34	9	49	63	43	26	13	115	33	432	65	34	52
061-Paper2566	Analysis of Suture Force Simulations for Optimal Orientation of Rhomboid Skin Flaps	56	40	18	69	39	22	207	74	50	28	7	99	68	166	114	69	8	161
062-Paper2830	Anatomical Landmark Detection Using a Multiresolution Learning Approach with a Hybrid Transformer-CNN Model	54	63	25	62	59	5	211	182	5	35	30	1	218	69	100	50	62	4
063-Paper0270	Anatomical-aware Point-Voxel Network for Couinaud Segmentation in Liver CT	70	19	49	174	8	25	99	36	12	1	83	6	13	591	53	59	8	5
064-Paper0383	Anatomy-Driven Pathology Detection on Chest X-rays	72	69	14	8	40	28	33	43	124	59	18	8	109	158	50	52	6	69
065-Paper1594	Anatomy-informed Data Augmentation for Enhanced Prostate Cancer Detection	72	27	76	98	49	84	95	107	68	5	5	12	23	72	338	14	47	52
066-Paper2034	Aneurysm Pose Estimation with Deep Learning	67	128	73	101	76	53	45	192	30	33	15	76	34	2	229	28	18	59
067-Paper0522	AngioMoCo: Learning-based Motion Correction in Cerebral Digital Subtraction Angiography	62	128	28	14	39	23	52	466	81	9	16	16	52	68	52	14	126	14
068-Paper2152	Annotator Consensus Prediction for Medical Image Segmentation with Diffusion Models	14	29	46	28	21	47	35	20	161	10	13	14	20	87	16	21	25	3
069-Paper2200	Anti-Adversarial Consistency Regularization for Data Augmentation: Applications to Robust Medical Image Segmentation	109	85	24	105	87	14	87	306	133	20	20	7	145	15	23	49	114	6
070-Paper2382	AR2T: Advanced Realistic Rendering Technique for Biomedical Volumes	105	67	143	69	41	179	163	273	134	97	21	150	141	28	294	36	45	148
071-Paper3171	Ariadne's Thread: Using Text Prompts to Improve Segmentation of Infected Areas from Chest X-ray images	82	91	46	52	83	62	54	121	42	40	3	9	193	14	19	60	11	40
072-Paper1249	ArSDM: Colonoscopy Images Synthesis with Adaptive Refinement Semantic Diffusion Models	91	101	57	59	98	12	39	134	260	12	31	12	39	85	10	32	45	15
073-Paper0943	Artifact Restoration in Histology Images with Diffusion Probabilistic Models	27	35	82	45	30	67	32	19	19	14	3	169	109	55	206	5	6	108
074-Paper1934	ASC: Appearance and Structure Consistency for Unsupervised Domain Adaptation in Fetal Brain MRI Segmentation	38	22	29	56	9	28	156	13	179	11	23	13	76	95	23	29	17	12
075-Paper1927	ASCON: Anatomy-aware Supervised Contrastive Learning Framework for Low-dose CT Denoising	64	59	61	87	77	52	53	46	93	16	20	13	52	34	53	23	31	47
076-Paper2274	Assignment Theory-Augmented Neural Network for Dental Arch Labeling	42	57	67	15	56	9	85	48	68	2	11	1	40	42	50	40	21	21
077-Paper1850	Asymmetric Contour Uncertainty Estimation for Medical Image Segmentation	78	36	93	55	18	42	261	45	21	12	13	43	103	187	332	35	23	27
078-Paper2614	Attentive Deep Canonical Correlation Analysis for Diagnosing Alzheimer's Disease using Multimodal Imaging Genetics	18	104	95	33	78	116	42	75	128	17	1	65	100	22	2	18	4	25
079-Paper1623	atTRACTive: Semi-automatic white matter tract segmentation using active learning	33	106	20	38	261	31	8	52	81	13	97	11	25	482	10	63	34	14
080-Paper1042	AUA-dE: An adaptive uncertainty guided attention for diffusion MRI models estimation	67	33	51	23	33	94	104	28	107	10	1	17	100	344	5	33	25	32
081-Paper3582	Automated CT Lung Cancer Screening Workflow using 3D Camera	86	118	48	164	88	26	220	67	178	28	39	51	47	124	99	38	74	10
082-Paper0174	Automatic Bleeding Risk Rating System of Gastric Varices	60	80	51	24	77	52	92	56	22	17	14	25	45	41	97	17	48	17
083-Paper0836	Automatic Retrieval of Corresponding US Views in Longitudinal Examinations	124	158	67	22	155	49	75	201	340	16	56	16	49	53	177	17	46	40
084-Paper2746	Automatic Segmentation of Internal Tooth Structure from CBCT Images using Hierarchical Deep Learning	54	22	66	40	19	129	91	29	27	48	4	37	133	40	67	35	29	22
085-Paper2247	Automatic Surgical Reconstruction for Orbital Blow-out Fracture via Symmetric Prior Anatomical Knowledge-Guided Adversarial Generative Network	26	103	91	18	47	68	48	58	66	16	71	22	9	75	217	19	12	9
086-Paper0682	B-Cos Aligned Transformers Learn Human-Interpretable Features	76	71	81	78	27	137	134	106	383	4	4	7	15	96	210	28	22	27
087-Paper2016	BerDiff: Conditional Bernoulli Diffusion Model for Medical Image Segmentation	139	43	29	50	82	60	10	156	212	21	8	17	27	2	72	58	8	12
088-Paper1399	Beyond the Snapshot: Brain Tokenized Graph Transformer for Longitudinal Brain Functional Connectome Embedding	61	21	72	61	65	35	103	82	71	23	13	11	252	125	22	7	18	25
089-Paper1392	Bidirectional Mapping with Contrastive Learning on Multimodal Neuroimaging Data	58	67	102	65	105	165	41	22	63	1	15	57	46	135	119	14	33	34
090-Paper2993	BigFUSE: Global Context-Aware Image Fusion in Dual-View Light-Sheet Fluorescence Microscopy with Image Formation Prior	34	63	49	142	29	64	25	12	68	13	8	14	19	189	91	35	82	7
091-Paper1973	Black-box Domain Adaptative Cell Segmentation via Multi-source Distillation	88	60	58	86	29	47	251	90	189	3	6	15	8	2	8	12	33	33
092-Paper1650	Boosting Breast Ultrasound Video Classification by the Guidance of Keyframe Feature Centers	39	80	63	32	34	82	17	203	254	1	2	87	118	242	349	20	26	78
093-Paper1247	Boundary Difference Over Union Loss For Medical Image Segmentation	98	42	43	145	134	18	61	41	147	60	12	4	83	163	26	78	53	39
094-Paper2691	Boundary-weighted logit consistency improves calibration of segmentation networks	95	51	133	60	69	269	56	149	235	12	12	87	9	244	117	26	55	37
095-Paper0844	Brain Anatomy-Guided MRI Analysis for Assessing Clinical Progression of Cognitive Impairment with Structural MRI	43	14	13	81	30	13	51	224	111	44	30	1	180	5	2	39	34	20
096-Paper1572	BrainUSL: Unsupervised Graph Structure Learning for Functional Brain Network Analysis	35	26	14	50	49	14	187	44	16	22	10	16	49	145	69	20	9	14
097-Paper1347	Breast Ultrasound Tumor Classification Using a Hybrid Multitask CNN-Transformer Network	50	83	103	28	55	66	91	49	166	25	23	30	57	276	88	33	38	53
098-Paper2554	Bridging ex-vivo training and intra-operative deployment for surgical margin assessment with Evidential Graph Transformer	15	31	71	24	52	24	20	48	10	15	7	7	56	139	22	26	93	11
099-Paper1146	Building A Bridge: Close The Domain Gap in CT Metal Artifact Reduction	90	24	46	202	24	35	236	150	199	35	7	37	95	11	21	63	4	49
100-Paper2579	Can point cloud networks learn statistical shape models of anatomies?	59	58	51	64	28	155	80	18	168	11	12	32	112	35	139	47	35	52
101-Paper1428	CARL: Cross-aligned Representation Learning for Multi-view Lung Cancer Histology Classification	96	95	40	86	74	30	196	24	98	25	7	35	338	7	586	45	9	46
102-Paper3517	Cascade Transformer Encoded Boundary-Aware Multibranch Fusion Networks for Real-Time and Accurate Colonoscopic Lesion Segmentation	63	81	39	181	102	44	197	80	64	52	16	7	533	23	40	114	25	20
103-Paper0651	CAS-Net: Cross-view Aligned Segmentation by Graph Representation of Knees	71	137	58	41	57	24	155	20	32	17	24	12	38	86	23	17	18	24
104-Paper0442	Category-independent Visual Explanation for Medical Deep Network Understanding	141	33	62	79	37	27	24	32	146	11	25	24	38	116	123	141	31	18
105-Paper0176	Category-level Regularized Unlabeled-to-labeled Learning for Semi-supervised Prostate Segmentation with Multi-site Unlabeled Data	74	54	46	77	81	18	101	21	62	52	3	2	7	12	62	30	14	18
106-Paper2024	CAT-ViL: Co-Attention Gated Vision-Language Embedding for Visual Question Localized-Answering in Robotic Surgery	49	60	78	32	34	132	53	99	214	8	8	40	42	34	79	36	40	19
107-Paper0204	CDiffMR: Can We Replace the Gaussian Noise with K-Space Undersampling for Fast MRI?	66	50	86	73	60	42	30	1	191	33	14	14	103	104	48	32	15	40
108-Paper0672	CellGAN: Conditional Cervical Cell Synthesis for Augmenting Cytopathological Image Classification	20	93	57	85	41	24	62	35	55	13	24	34	32	67	115	70	50	10
109-Paper0692	CenterlinePointNet++: A new point cloud based architecture for coronary artery pressure drop and vFFR estimation	21	80	47	14	27	66	61	24	100	13	16	15	240	95	100	25	14	39
110-Paper0619	Centroid-aware feature recalibration for cancer grading in pathology images	37	64	21	31	77	34	22	138	41	3	34	15	5	27	61	4	18	31
111-Paper2489	Certification of Deep Learning Models for Medical Image Segmentation	69	83	90	60	64	144	184	96	197	161	18	35	178	175	171	71	6	51
112-Paper0586	Chest X-ray Image Classification: A Causal Perspective	30	67	41	43	36	17	15	167	165	2	14	1	145	430	3	17	37	19
113-Paper2463	CheXstray: A Real-Time Multi-Modal Monitoring Workflow for Medical Imaging AI	23	74	19	66	82	8	61	139	0	9	1	9	14	82	10	20	10	3
114-Paper0478	CircleFormer: Circular Nuclei Detection in Whole Slide Images with Circle Queries and Attention	18	24	69	15	30	59	9	38	47	4	15	22	9	23	69	9	30	19
115-Paper2139	CL-ADDA: Contrastive Learning with Amplitude-Driven Data Augmentation for fMRI-Based Individualized Predictions	53	30	61	148	31	39	170	47	230	17	3	15	3	243	48	34	37	23
116-Paper0966	Class Specific Feature Disentanglement And Text Embeddings For Multi-Label Generalized Zero Shot CXR Classification	95	22	59	80	17	52	77	39	32	15	11	1	30	232	43	37	16	5
117-Paper0956	Class-Aware Feature Alignment for Domain Adaptative Mitochondria Segmentation	64	92	61	119	363	55	236	245	50	46	136	14	15	140	47	56	89	16
118-Paper1871	Client-Level Differential Privacy via Adaptive Intermediary in Federated Medical Imaging	53	47	23	43	25	77	16	71	273	45	4	35	45	6	303	43	14	69
119-Paper2270	Clinical Evaluation of AI-assisted Virtual Contrast Enhanced MRI in Primary Gross Tumor Volume Delineation for Radiotherapy of Nasopharyngeal Carcinoma	105	31	107	100	38	54	90	157	69	27	15	40	187	45	99	32	9	71
120-Paper1961	CLIP-Lung: Textual Knowledge-Guided Lung Nodule Malignancy Prediction	129	53	51	433	19	29	190	113	31	112	9	8	626	102	61	140	10	16
121-Paper0680	Cluster-Induced Mask Transformers for Effective Opportunistic Gastric Cancer Screening on Non-contrast CT Scans	33	91	20	26	19	24	74	11	101	12	23	10	14	206	23	33	11	14
122-Paper2079	Clustering disease trajectories in contrastive feature space for biomarker proposal in age-related macular degeneration	12	28	59	50	11	65	130	37	69	1	26	3	5	373	62	24	34	86
123-Paper0169	CoactSeg: Learning from Heterogeneous Data for New Multiple Sclerosis Lesion Segmentation	91	57	52	31	40	159	93	18	205	42	13	17	358	60	142	30	16	38
124-Paper1473	Co-assistant Networks for Label Correction	34	16	31	58	25	35	44	60	70	23	3	11	143	45	13	31	17	10
125-Paper1393	Cochlear Implant Fold Detection in Intra-operative CT using Weakly Supervised Multi-Task Deep Learning	139	67	46	124	47	6	403	74	8	27	61	21	51	458	101	149	26	52
126-Paper2305	CoLa-Diff: Conditional Latent Diffusion Model for Multi-Modal MRI Synthesis	55	68	24	82	52	29	121	91	99	30	20	9	124	57	11	45	40	19
127-Paper0107	Co-Learning Semantic-aware Unsupervised Segmentation for Pathological Image Registration	106	48	40	121	59	39	156	440	30	40	14	50	20	72	94	24	17	43
128-Paper1979	Collaborative modality generation and tissue segmentation for early-developing macaque brain MR images	78	127	54	58	13	51	12	172	38	7	18	14	7	37	135	9	47	8
129-Paper0594	COLosSAL: A Benchmark for Cold-start Active Learning for 3D Medical Image Segmentation	117	86	20	183	138	66	378	136	113	4	10	30	421	93	94	62	93	26
130-Paper0232	Combat Long-tails in Medical Classification with Relation-aware Consistency and Virtual Features Compensation	71	78	106	81	49	160	58	39	164	39	102	46	422	254	177	57	55	24
131-Paper2991	Combating Medical Label Noise via Robust Semi-supervised Contrastive Learning	140	29	51	38	30	61	50	235	21	29	69	5	202	46	60	26	112	10
132-Paper1939	Community-Aware Transformer for Autism Prediction in fMRI Connectome	61	66	63	49	77	103	74	165	94	18	34	10	223	199	88	126	64	54
133-Paper1089	Computationally Efficient 3D MRI Reconstruction with Adaptive MLP	59	28	29	194	27	56	152	74	54	5	5	7	110	28	61	70	38	39
134-Paper3305	Conditional Diffusion Models for Weakly Supervised Medical Image Segmentation	38	93	135	62	140	90	254	119	23	25	62	21	86	104	72	59	136	68
135-Paper0259	Conditional Physics-Informed Graph Neural Network For Fractional Flow Reserve Assessment	108	38	133	60	28	90	62	26	119	24	33	28	408	145	34	36	25	76
136-Paper1290	Conditional Temporal Attention Networks for Neonatal Cortical Surface Reconstruction	52	50	80	150	64	23	32	213	24	5	17	2	272	434	57	15	81	23
137-Paper0848	Consistency-guided Meta-Learning for Bootstrapping Semi-Supervised Medical Image Segmentation	44	58	140	91	66	20	72	40	62	17	13	11	58	102	78	13	35	17
138-Paper1221	Content-Preserving Diffusion Model for Unsupervised AS-OCT image Despeckling	14	46	65	20	35	47	104	90	78	16	14	10	58	12	13	13	14	18
139-Paper0770	Context-Aware Pseudo-Label Refinement for Source-Free Domain Adaptive Fundus Image Segmentation	21	91	81	10	54	23	26	68	117	33	18	11	25	130	11	14	9	25
140-Paper0621	Continual Learning for Abdominal Multi-Organ and Tumor Segmentation	78	43	109	63	33	122	74	34	201	9	6	55	138	20	70	63	10	66
141-Paper3247	ConTrack: Contextual Transformer for Device Tracking in X-ray	55	88	54	130	43	121	171	97	54	12	40	14	174	904	199	16	51	26
142-Paper1275	Contrastive Diffusion Model with Auxiliary Guidance for Coarse-to-Fine PET Reconstruction	127	72	58	95	16	26	53	30	241	10	16	10	22	116	5	23	2	27
143-Paper1098	Contrastive Feature Decoupling for Weakly-supervised Disease Detection	23	25		39	31		45	19		19	16		122	121		22	28	
144-Paper1768	Contrastive Masked Image-Text Modeling for Medical Visual Representation Learning	48	48	45	35	72	50	25	52	44	26	43	9	44	32	17	43	40	34
145-Paper2620	ConvFormer: Plug-and-Play CNN-Style Transformers for Improving Medical Image Segmentation	68	96	50	36	29	74	64	47	170	24	1	21	75	238	113	23	40	63
146-Paper3654	Convolving Directed Graph Edges via Hodge Laplacian for Brain Network Analysis	55	71	25	80	96	30	265	21	53	12	37	25	24	23	39	33	41	46
147-Paper0206	cOOpD: Reformulating COPD classification on chest CT scans as anomaly detection using contrastive representations	34	120	70	17	33	26	83	17	10	15	11	33	40	126	304	5	38	31
148-Paper0603	Correlation-Aware Mutual Learning for Semi-supervised Medical Image Segmentation	83	87	129	23	74	65	138	20	143	18	37	10	268	61	15	11	15	45
149-Paper2102	CorSegRec: A Topology-Preserving Scheme for Extracting Fully-Connected Coronary Arteries from CT Angiography	130	20	47	83	86	61	36	37	83	7	18	47	120	46	67	50	31	47
150-Paper2218	CortexMorph: fast cortical thickness estimation via diffeomorphic registration using VoxelMorph	96	50	39	54	47	46	52	70	36	20	7	27	215	30	129	24	3	30
151-Paper0363	Cortical analysis of heterogeneous clinical brain MRI scans for large-scale neuroimaging studies	65	113	82	63	22	15	131	99	48	27	7	16	128	104	89	60	45	17
152-Paper2725	Coupling Bracket Segmentation and Tooth Surface Reconstruction on 3D Dental Models	51	44	76	12	45	38	20	11	34	1	15	21	165	11	114	7	5	41
153-Paper1449	COVID-19 Pneumonia Classification with Transformer from Incomplete Modalities	16	34	111	14	15	167	5	39	176	18	3	18	9	64	54	2	4	150
154-Paper1030	Cross-adversarial local distribution regularization for semi-supervised medical image segmentation	19	58	63	19	22	79	72	117	73	3	9	19	71	19	8	33	23	27
155-Paper1398	Cross-Dataset Adaptation for Instrument Classification in Cataract Surgery Videos	28	57	27	21	62	31	37	251	46	23	27	20	17	126	251	17	49	41
156-Paper1273	Cross-modulated Few-shot Image Generation for Colorectal Tissue Classification	45	22	49	47	23	32	101	17	106	21	11	7	2	37	30	15	23	27
157-Paper2880	Cross-view Deformable Transformer for Non-displaced Hip Fracture Classification from Frontal-Lateral X-ray Pair	91	68	54	77	63	66	108	93	30	6	23	22	84	19	185	32	41	25
158-Paper1811	CT Kernel Conversion Using Multi-Domain Image-to-Image Translation with Generator-Guided Contrastive Learning	23	16	53	57	22	20	86	104	64	50	1	1	9	104	13	39	2	12
